score,reple
6,미국대통령이 너무나 쉽고 허술하게 납치되는 과정을 보면서 어이상실 한번 하고 백악관이 이 사실조차 모른다는데서 두번 어이상실.. 예의없고 안하무인의 미대통령의 코미디 캐릭터를 보면서 기대 접고 봄.. 잠수함 액션은 볼만함
1,"평점높은거 알바라고 보면되요. 개실망했습니다. 저 배우들을 데리고 이정도밖에 안되나요? 억지스러운 스토리와 웃기고 싶은 욕망, 아마추어같은 영상미, 기억나지않을 음악까지..."
2,"낚였다~억측난무, 정치 다큐 영화"
7,재미있게 봤는데 마지막에 너무 정치적인 제스쳐를 강요하는거 같아요.
4,2시간짜리 역사수업. 하품을 멈출수가없네 국뽕은 왜이리 심한거냐.문재인의 판타지 봐주느라 힘들었다.
1,전편보다 지루함 스토리도 별로임
2,방금 보다가 너무 졸려서 중간에 나왔음완전 최악.비추. 가족들하고 보려다가 혼자본게 그나마 다행.
1,잼없다. 보지마라!절대로~~
1,아 진짜 개 쓰레기 영화이런 영화에 쓴 내 Kt멤버쉽포인트가 아깝다.현실성없는건 둘째치고 내용이 너무 재미없고시나리오 쓴사람이 진짜 못배운 티 남.  저런 시나리오로 어떻게 투자를 받았지?대통령 관저 청와대가 무슨 20평대 아파트 같질않나 대통령 가족을 무슨 중산층 가정처럼 묘사해놓질않나 고증엉밍에  아무리 북한이래도 3자회담을 3류 모텔같은데서 하질않나 ㅋㅋㅋㅋ 잠수함 씬은 80년대 우뢰매보는줄 ㅋㅋㅋㅋ 암튼 대학생 독립영화도 이정도는 아니겟다. 그냥 감독의 짧고 편협한 지식으로 상상한 시나리오 쓰레기 영화.
6,개연성도 없고... 너무 별로였어요 계속시간봤네요 언제끝나나
1,"문쩝쩝이가 보고 눈물을 흘릴 영화이네요 ,,,"
1,요즘 한국 영화 판 보면 나치  선전선동물 보는 것 같다
2,미국 대통령은 우스꽝스럽게 만들고 북한 장군은  국가와 국민에 충성을 다하는  영웅으로 만들어놨네...
1,개연성 1도없는 OOO기 5류 저급 영화그나마 액션씬이라고는 잠수함에서 버튼몇개 누르면서 고함만쳐대면 미사일 다피함
6,1편 재밌게 봤지만 기대는 안 했는데도 아쉬움 똥이랑 방귀로 개그 치는데 이게 뭔가 싶었다
1,정치병자들을 위한 영화
1,진짜 개노잼입니다 보지마세요
1,우리의 주적은 북한입니다.미국이 아니에요 ...
1,별 한개도 아까움...
4,막바지 잠수함컷 만 볼만 하고 나머진....
6,기대가 컸는데 그냥그럼 (수정) 말아먹은 듯한  전반부 1시간30분 말고 자꾸 후반부 잠수함 액션신가지고 최고다 막 이러시는 알바평점이 보이는데요...그냥 헌터킬러 울프콜이던데요?요즘 짬뽕이 트렌드인가 반도도 그렇고
6,배우들은 좋은데 다들 연기도 잘하는분들인데 영 스토리가 별로네요
2,반미반일 친북 영화 끝.
6,그냥 그랬어요 잠수함에서 싸우고 끝ㅜ
1,진짜 핵노잼.강철비 1은 뽀록이였어우성이형 작품 선택하는 눈이 최근들어 쫌 그러네~액션도 없고지들끼리 투닥거리다 끝남겁나 지루함.차라리 반도 나으려나?마지막엔 신파~에휴~~나만 당할 순 없다.
1,문재앙 미화영화냐ㅋㅋㅋㅋ 문재앙이 북한에한 호구짓을 미화시키네  ㅋㅋ
1,미국대통령이 방귀를 뀌는 장면... 감독의 정서수준이 엿보임
1,재미도 감동도 없는 영화네요        팝콘도 눅눅하고       정우성은 발연기하고    총체적난관이네요         며칠뒤 황느님 영화개봉하던데   내상치유하러 또 가야겟네
1,별점 한개도아까움. 보다 나옴 ㅡㅡ역대급최악의영화
2,너무.. 별로였음 비추 합니다.... 기억나는건잠수함 뿐..
2,진짜.. 강철비 1 기대하고 보시지 마세요..영화에 참신함은 하나도 없고 진짜 개 억지만 주구장창 늘여놓는데 보는데 진짜 이건 좀 아니지않나 싶어서 친구눈치봄 ㅋㅋㅋㅋ
3,별로입니다
2,완전 쓰레기같은 영화지금정권에 아부하는 그것도대표.적인 정우성이 대통령
6,영화는 그저그랬습니다. 주연들 보다는 부함장역의 신정근님만 집중해서 보게되더라구요.잘 봤습니다
1,스토리를 보고도 이딴 걸 35만명이나 쳐보고 있네.대단하다 진짜
5,강철비1을 정말 재미있게 본 사람으로서 많이 실망함. 일단 미국 대통령이 너무 무식하지만 힘만 쎈 캐릭터로 나오는 감이 있음. 그리고 국제정세를 다루는 상업영화 특성상 정치적 중립성을 유지하는게 제일 중요한데 이 영화는 한쪽으로 약간 치우친 경향이 없지 않아 있음. 그런데 애초에 정치적 성향 다 빼고 영화 자체로만 봤을때도 1편에 비해서 한참 못미치고 재미가 없음. 근데 장점이 아예 없는건 아님. 후반부 잠수함 액션장면과 영상미는 좋았음. 하지만 그것 빼고는 남는게 없음. 너무 실망임.
1,하... 그래서 좌빨나라 광고하냐 진짜 손발오그라드네
5,영화시간 절반이 잠수함 이야기로 가득찬 영화..아쉽다
4,ㅜㅜ 두시간이 넘는데 끝에 30분 빼고는 지루함
5,유머를 사용하고 싶었으면 새로운 케릭터를 집어넣어야 했다. 진지해야할 케릭터들이 집중력이 낮아진다. 결말도 아쉽다
2,대통령들의 노잼인 반상회 ㅋ
1,북에서 개봉하면 인기많을듯 ㅋㅋㅋ 김정은 미화영화
2,진짜 보지마세요 ㅋㅋ 장난합니까
1,무료로 풀어도 볼까말까 생각해봐야 하는영화
1,대놓고 그 당에서 만든 영화재미라도 있던가 재미도 없네
5,트럼프가 저렇게 멍청할거같아...???
1,"좌파영화이면 재미라도 있던가. 재미도 없고 억지감동 밖에 없다. 쿠데타+ 잠수함+ 납치 소재는 외국영화 ""헌터킬러(20OOO작)""  그대로 따라해놓고 재미도 없냐."
1,일본이 미국한국북한 지도자를 납치한다? 에라이
3,지금 강의하십니까? 보고 나서 무척 기분 안좋습니다
8,연기는 훌륭했지만 아쉬운게 북조선이 너무 미화된듯한 나낌을 받았다. 그 부분이 맘에 들지 않았다. 그래도 배우들 연기는 대단했다.
1,최악이다.강철비1만 봤었어야 했다.역시나 정우성의 연기는 죽을때까지 발연기를 할 요량인가 보다.이거 볼 시간과 돈으로 차라리 집에서 다큐보면서 치맥을 하는게 훨씬 낫다..최악 오브 더 최악
1,"이게 영화냐?미국 3류 배우데려다놓고 방구끼고, 똥싸고. 헐크로 변신하는게   유머라고...  덴장   눈뜨고 볼수가 읍네    그냥 3류 쓰레기 영화..."
1,별도아까운영화  이딴걸만드냐
1,별로 재미없음
1,멋이 너무들어갔음. 지루하네요..
1,알바 쓰지마라ㅡㅡ 좌빨선동영화
1,"트럼프가 미친 건 사실이지만, 아무리 그렇다고 우방국을 무기나 팔아먹는 쓰레기 국가로 묘사하고 북한은 갑자기 힘없고 정의로운 국가로 돌변 ㅋㅋㅋ 예술하는 애들이 좌파성향이 강한 건 익히 알고 있지만 이건 정도가 너무 심하네. 미국 물러나고 북한과 손잡고 강성대국 만들어보시라우요, 거 어디까지 발전할 수 있나 함 봅시다. 내 예상은 개발도상국으로 전락할 가능성이 99%지만."
2,감독 이 정도면 같이 고생한배우 스텝에게 사과해야할듯 양우석 감독 영화는 이제 안보려함
2,솔직히 캐스팅도 좀 형편없고 내용도 그닥.. 그냥 문재앙 미화영화같음 정우성이 문재인임 차라리 곽도원을 김정은역할로하고 유인석을 쿠데타일으킨사람으로 바꿨으면 좋았을듯 트럼프대통령(스무트)이 쉽게 납치되는것도 어이가없고 그냥 영화가 좌파영화임 변호인처럼
2,너무 노골적인 반미 친북영화라 거부감
2,개구림 ㄹㅇ 정치극이 어떻게 이렇게 1차원적이지
2,"우호적 대북 관계를 종용하는 늬앙스를 느꼈습니다. 통일. 선택하라...?통일을 위한 일이니 지금 우리가 하는 일은 잘 하고 있는 일이다. 믿고 지지해라.혼자 너무 간 생각일 수 있겠네요. 그렇지만 이런 생각이 드는 건 저만이 아닐 거라고 생각하며, 영화에 정치적 색이 묻어나는 것 같아 아쉬운 마음에 몇 글자라고 남깁니다."
1,어머~  이 영화를 보고 역사를 배우게 되었어요~ 우웩 개 토악ㅈㅣㄹ나오넼ㅋㅋ
2,극장에서 내 돈 내고 볼 영화는 절대 아닙니다.그냥 나중에 풀리면 보세요. 연기도 어색하고 ㅠ
1,무슨 영화가 소리만 지르는 장면만 생각 나고 ㅋㅋ
4,"감독이 뭘 원하는지는 알겠으나, 내용이 횡설수설하며 연출이 매우 아쉽고 울프 콜을 연상시켰으나 재미가 없음. 한마디로 추천안함. 차라리 다른 영화보세요."
1,아ㅠㅠ 내 2시간이 아까움중간에 나가고싶어서 혼남아아
1,시작부터 끝까지 모든 1초가 아깝다.내 시간을 돌려받고 싶다.국제관계에서 일어날 수 없는 모든 경우의 수를 한심할 정도로 유치하게 표현했다.반미 친북 내용을 표현하고 싶었다면 은근히 해야 사람들이 몰입하지 이렇게 어설프고 유치하며 오글거리게 하면 그 누가 동조하나? 비웃음만 나올뿐.
1,"억지웃음코드,이상한 정치적 프레임...반도부터 참 코로나이후 영화 상태가 영...한국영화 망했다진짜2020...알바들 판 치고 보지마세여 걍 정치적프레임 액션 다 이상하고 재미없어요"
2,ㅋㅋㅋ죨라재미도없고 반비 친북영화 ㅋㅋㅋ 어휴 빨갱이내용도쓰레기 ㅋㅋㅋ
1,"진심 여기 10점 주는 사람들 다 알바가 아닐까 함. 생애 태어나서 본영화중 최악중에 최악. 그저 반미 반일 감정 부추기고 &#34;서민적이고 감성적인&#34; &#34;사람을 위한&#34; 한국 대통령 찬양.그것들이 잘 어울려졌음 좋았겠지만, 상당히 과해서 불편하고 불쾌하다 역겹기까지 함."
2,그냥그래.... 볼거면...보ㅏ...
1,원숭이 엉덩이 같은 영화
1,시간아깝고 돈도아까움
1,지겹다 이제 그만하고 다른 주제 좀 들고와라
1,정우성 출연하는 영화는 믿고 거릅니다.정우성이 출연하는 영화는 일단 재미도없고 항상 감동도 없어요 거기에 정우성은 정치배우가 돼서 그간 가뜩이나 재미도없었는데 그가 출연하는 영화보면 이젠 기분도 나쁘죠 그러니 공짜로 보기도 싫은 영화입니다.
1,대한민국 영화계가 친민주당/친북지상주의에서 벗어날 수 있는 날이 오기는 할까?
1,억지웃음+감동
4,.
2,너무한다는생각밖ㅇ니ㅣ
1,진짜 시간낭비함 나만 당할 수 없다
1,평점 처음 달아보는데 진짜 보지마세요.. 정말 할인받고 오천원에 받는데도 너무너무너무너무너무너무너무 아까워요 ㅠㅠ
2,보지마세요.. 진심입니다
1,그놈의 북한 지겹다. 미화안하면 죽는 병이라도 생기셨나
1,"믿고거르는 정우성, 선동용 정치영화"
2,감상평 믿지마세요. 댓글처음남깁니다.이건 뭐. 해도해도 너무한 문정권 찬양하는 정도의정말 영화까지 이렇게 통치받네요.문재x은 정우성이고 마지막나오는 그 여총리는 추미x고보시면 압니다. 제말이 무슨말인지 너무 나가고 싶은데겨우참았습니다.
1,난 광주 사람인데도 불구하고 너무 영화가 민족주의 내세움.   나치 히틀러.  모택동 문화혁명.  캄보디아 크미르루주 생각 나네요.    시대가 언진데 민족주의인가 싶음.
1,어떻게 이런 영화를 만들었는ㅈ진짜 재미없음 돈아까움영화 보는중에 졸다가 폰들어 글쓰고 있음반도나 볼껄.. 반도는 스릴이라도 있을꺼같은데 이건뭐 말같지도 않은 전개네이버평점 알바 풀지마라
1,이야..영화를 이렇게 못만드나..마지막부분에 신정근배우 활약하는 부분 외에는 진짜 지루했다.3국 대통령들을 배의 한곳에 모아놓고 개그를 치고있고..미국대통령을 무슨 푼수때기로 만들어놓았네ㅋㅋㅋ염정아가 정우성한테 한숨쉬지말라고 엉덩이 때리는 장면이 가장 기억에 남는다
1,그냥 정치색 강한 쓰레기 영화. 북한 적당히 미화해라
1,평점들이 왜 이리 안좋은지 이해가 잘 안되네요 요즘 모텔 대실만해도 최소 3만원은 나갑니다 근데 전 만원내고 두시간동안 잘 자고 나와서 나름 만족스러웠네요 근데 무슨 영화인지 뭔지 암튼 OOO 같은거 틀어놔서 좀 시끄럽긴 합니다 소리에 예민하신 분들은 다른데 이용 하시는게 나을듯
1,시대착오적인 반일 영화 ㅠㅠ
1,최악입니다.좌파정권 들어온 이래 대한민국 영화는 더이상 영화가 아닙니다. 최악이에요 최악
1,"아 18 진짜 조나 재미없네 18 김정은이가 그리 날씬하냐? 멋 개조니 환상을 그려놨누 셋이 모여 여행 한번가재 아 개웃겨., 그나마 강철비 1은 좀 괜찮더만 정우성은 연기도 못하는데 아주 그냥 정우성을 위한 영화네., 솔까 평점 조나 낮어서 일말의 기대도안했는데 아 지루해 죽는줄., 왜 야나두 라했는지 알겠다 조낸영어로떠들구 시끄럽고 오합지졸 그 자체임 그와중에 개 18 총무 아지매년 자꾸 떠올라서 더 짱났음 멋있는척 감동적인척 와방 하는데 관객이랑 공감안됨; 무엇보다 김정은 개돼지를 왜 잘생기고 날씬한 유연석이 함? 문제인은 정우성임?; ㅋ"
1,김정은 돼지를 제대로 표현해야지 뭐냐 ㅋㅋ
1,노잼 영화입니다.잠만자고왔습니다.하하하
1,한국 배우들 연기 잘 하는 거 빼고는 아주 볼폼없는 영화
1,대깨문들의 판타지 영화
1,영화를 재미로 보는것도 정도가 있지. 영화의 가장 큰 축인 스토리부터  대놓고 억지에 누가봐도 김정은이 OOO인데 그걸 미화하네. 공짜로라도 볼 일 없는 영화고 돈주고 볼거면 그냥 돈 찢어라. 도움 전혀 안되는 영화다
1,정부에서 만든 영화인줄 ㅡㅡ
