score,reple
10,진짜 셀린 시아마 엔딩 장인... 최고..!!!
10,너무 좋아하는 셀린감독... 영상. 음악. 연기 머하나 빠지지않는 가장 감각적인 영화!
10,아델 에넬 어릴 적 모습으로 이미 게임 오버... GG 여자 청소년의 욕망을 이리도 솔직하고 담백하게 담아낸 것에 셀린에게 또 한번 놀란 작품....!
10,영상미랑 음악이랑 분위기 너무 좋음 ㅠㅠㅠ 여름 분위기랑도 찰떡..
10,역시 셀린 시아마.. 첫사랑의 설렘 보다는 욕망 그대로를 표현해서 좋았다 아델 에넬의 풋풋한 모습까지 볼 수 있다니 이건 정말 꼭 봐야해!!
10,"첫 만남, 첫 사랑, 첫 욕망 설렘 가득한 첫번째 순간들을 잘 녹여낸.. 이 여름에 잘 어울리는 영화"
10,셀린과 아델의 강렬한 첫만남을 보는 것만으로도 충분하다!
10,초창기 아델 에넬의 매력을 담은 작품을 스크린에서 다시 볼 수 있어서 행복했음
10,모든 포인트가 너무 좋아서 하나만 못 고르겠음ㅠㅠ 너무 좋은데 뭐라고 말해야할 지 모르겠다..!
8,생경한 소재로 풀어낸 미묘한 감정의 흐름
10,이 감독의 영화는 항상 좋네요섬세하고 드라마가 있어요
10,아델이면 평생 짝사랑 쌉가능
10,"아델 에넬의 영상화보보고나면 셀린시아마를 고소하고싶어진다는 말이 실감나더군요셀린시아마 감독은 따스한 사람이라는걸천재라는걸 불초상,톰보이,워릴을 보고다시금 느낍니다걸후드가 더더욱 기다려집니다."
10,친구들과 봤는데 정말 재밌었어요...ㅠ 집가는 내내 영화 이야기만 했네요 엔딩 장면은 평생 잊지 못할 것 같아요
10,성장 영화 맛집 셀린 시아마
10,"믿고 보는 감독, 배우가 생겼따 ㅠㅠ 작품 열심히 만들어주세요"
10,믿고 보는 셀린 시아마!!
10,플로리안 미모가 대단해요
10,10년도 지난 영화지만 전혀 시대에 뒤떨어졌다는 느낌을 받지 못했어요 영상이 너~무 예뻐서 눈으로 캡처하고 싶다는 생각을 많이 했고 빈티지 감성 보시면 알 거 같아요 재미있어요!!
10,역시 셀린시아마 감독님!! 타여초 톰보이에 이어 워터까지 넘좋음~~
10,어떤 일을 겪어내든 아이들은 자신들의 방식으로 성장해나간다 그 모습이 참 감동적이고 어린 시절을 뛰어넘어 지금의 모습과도 연결시킬 수 있게 한다감독의 영상미는 정말 훌륭. 배우들의 어린 시절은 왜 이리 풋풋한지.
10,셀린과 아델의 조합은 진짜 사전에 남겨야한다...믿고 보세요 개봉해줘서 감사할 따름..ㅠㅠ
10,"톰보이, 타여초를 주변에서 너무 추천해서 접하게 된 셀린 시아마 작품들! 이번에도 후회 없는 선택이었다,,,"
10,"여름에 딱인, 보기만해도 시원한 장면들과 방황하는 사춘기 소녀들의 마음이 잘 드러난 영화!"
10,비주얼 배우들 연기 연출 다 미쳤음
10,말로 형언하기 힘든 묘한 여운이 남는 작품입니다. 세 여주인공들의 각기 다른 색깔과 그 중 중심인물의 절제된 언어와 억제할 수 없는 연민인지 사랑인지 처음 느끼는 감정에 대한 대조되는 과감한 행동..언어와 대비되는 그 행동 등 되게 센서티브한 터치가 어우러져 묘한 여운이 진하게 오래 남게되는 영화라는 생각이 간절하여 셀린 시아마 감독의 완전한 팬이 되어 버렸답니다.
9,성별을 떼고 사랑하는 감정선을 영상과 연기로 잘 표현한 영화
10,어린 아델 애넬의 매력이 단연코 돋보였던 영화!!! 성장기 배우들도 싱그럽고 수영장 신들이 많아 영화보는 내내 시원했습니다!!
10,셀린 시아마의 섬세한 연출이 감각적이고 아델의 모습은 매혹적입니다. 내내 눈을 뗄 수 없었네요.
10,아름다운 영상으로 청소년 시절 성과 사랑을 그려낸 수작
10,아니 어떻게 이게 데뷔작일 수가 있지다소 거칠게 데뷔해서 톰보이로 다듬고 완성된 부드러운 오묘함이 타여초인가8월8일에 봤는데도 개봉일 13일로 돼있어서 리뷰쓰려고 기다릴 정도
10,"일단 색감 영상미 연출이 너무 좋음,,,감각적이라는 말이 딱인듯! ㅠㅠ"
10,그 시기에만 있는 감정과 미묘한 관계들을 너무나도 잘 표현했다
10,"기다린만큼, 기대한만큼의 값어치가 있는 영화♡♡"
10,친구가 이 감독 최고라고해서 같이 보러갔는데 저도 감독한테 반했네요 영상미가 최고입니다!
10,이게 셀린 시아마가 감독의 데뷔작이라니 놀랍다.. 영상 음악 연기 뭐하나 빠지는 게 없다
10,"성장한 마리가 궁금해지는,,"
8,소녀들의 욕망을 담담하게 잘 풀어낸 영화
8,여성서사의 새로운 지점
10,최고야 영상미도 좋고 배우들 연기도 좋음 재밌엉
8,아름다운 영상과 음악 게다가 연기력 반짝반짝 이 여름을 시원하게 해줬네요
8,"시아마에겐 결과보다 과정이 중요한 것 같다.어떻게 마리가 프롤리안을 사랑하게 되고, 또 떠나게 되는가.그 과정을 지나면 우리는 사랑을 직시할 수 있게 된다.마지막 마리가 카메라는 보는 것처럼"
10,감정선이 정말 좋았습니다.
10,누구에게나. 개인적이고 보편적인.
10,
10,마리와 플로리안의 눈빛이 오래도록 잊혀지지 않네요. 소장하고 싶어지는 영화는 오랜만입니다.
10,"최근 ‘타오르는 여인의 초상’ 보면서 참 좋았는데, 초기 작품이 개봉한다하여 극장으로 바로 달려가서 봤습니다. 역시나 믿고 보는 셀린 시아마 감독님과 데뷔때부터 남달랐던 아델 에넬의 모습 최고입니다. 무조건 보세요 !! ^^"
10,
10,
10,코로나로 볼게 없던차에 기대없이봤는데 재미있게 봤습니다.
10,분위기 갑. 꼭 보고가야하는 감독님 작품이니까~
10,믿고 보는 셀린시아마~영상+음악 모두 최고
10,셀린 시아마 감독 연작.. 너무 좋네요!!
10,셀린 시아마 감독 작품은 언제나 옳음영상미 스토리 연출 빠지는게 없다
10,역시 셀린시아마~ 좋아요 감동적이에요
10,셀린 시아마가 그려낸 섬세한 감정선 인상적이다
10,믿고 보는 셀린 시네마 작품!     이 작품이 <타여초>보다 이전 작품이라니 실화임? 아델 에넬 데뷔작이라는게 다 충격! 감독님 깜짝 출연 귀여우심~~~
10,영상이 넘 이쁘네요. 강추!
10,여운이 많이 남는 감성적 작품입니다 자꾸 상각나서 또 보고 싶네요
10,데뷔작이라는 게 믿을 수가 없다. 맨날 잘하는 셀린 시아마
10,이 영화는 없던 짝사랑도 내 기억 속에 자리잡힐 듯... 여운에 못헤어나와
10,감동적이네요.  한번 더 보고 싶은 영화입니다
10,똘추비언 마리야 행복하자
10,
7,폴로리안 이랑 마리 너무 이쁘고 연기랑 감정선도 좋고 영상미도 이쁘고 재미있게 잘보고 왔어요!
7,수영장 물이 너무 예쁘다
6,색다르고 분위기있고 뒤로갈수록 흥미진지하고 재밌었습니다
10,너 무 조 아 ㅠㅠ 감 독 천 재 ㅠㅠ(?>?<?)
9,"여름이 그대로 느껴지는 영화. 사랑에 빠진 사람의 무력감, 슬픔, 분노. 첫사랑의 혼란이 담겨있는 영화다."
10,"셀린 시아마의 데뷔작이었다니 놀라웠다. 나는 불초상을 나중에 본 케이스인데, 데뷔작을 먼저 보게되었다는게 행운이라고 생각했다. 왜냐하면, 셀린 시아마 감독의 성장을 오롯이 느낄 수 있었기 때문이다. 아직 불초상을 보지 않은 관객이라면 워터릴리스를 먼저 관람한 후 불초상을 보길 추천한다. 워터릴리스의 원래 제목은 문어가 태어난 곳 이라고 하는데, 그 제목이 더 잘 어울린다."
10,
8,프랑스 영화는 늘 어렵네요~
10,싱크로나이즈 선수 플로리안을 본 마리가 사랑에 빠지게 된다.
10,분위기와 눈빛들을 잊을 수가 없어요
8,그다지 선호하지 않는 장르이지만 인물들의 심리를 섬세하게 잘 표현했고 마무리를 잘 한것 같다
9,이해도가 높은 편이 아니라서 주인공들의 감정을 완전히 알 수는 없었지만 서로 바라보는 눈빛이 인상적이었습니다. 수영장을 보며 시원함을 느낄 수 있어서 여름에 잘 맞는 영화라고 생각합니다.
9,감각적인 영화였어요 우연하게 접했는데여름에 어울리는 영화
10,
3,개억지텐션pc주의 없으면 영화 진행이 안되는건가..?아직은 못받아들이겠다.
10,세 캐릭터가 모두 내 일부이자 숨기고 싶은 치부들을 조금씩 가지고 있었다. 몰입할 수 밖에 없는 영화. 역시 셀린 시아마.
10,
9,그냥 좋았다... 첨벙첨벙
10,
7,물의 이미지로 투영된 성장통과 주체성의 시기.
10,"톰보이와 타오르는 여인의 초상 아주약간이 들어간 느낌. 어떤 시선도, 규정도 없는, 사랑을 갈구하고 감정에 충실한 그들. 상영할 때 꼭보세요."
10,짱.    .    ㅋ워터릴리스사랑해
9,음악들을 미리 듣고 봐서 그런지 ost들이 정말 강력했어요. 관람 계획이 있다면 미리 듣고 가는 것을 추천합니다!
10,
6,그 소녀와 소녀의 사정.
9,플로리안이 자꾸 제 친구랑 겹쳐보여 생각이 많았네요!
10,마지막 장면에서 마리 눈빛 무슨일이야!! 이 감독은 엔딩 천재라니까
10,믿고 보는 셀린. 영상미도 그렇지만 이 영화는 사운드가 진짜 한몫했네요
7,셀린 시아마의 연출력과 배우들의 감정 연기 등 장점이 많은 수작. 다만 데뷔작이므로 아직은 부족하다. 재능 발견 정도
10,"제가 본 퀴어 영화 중 제일 좋았어요. 타여초보다 훨씬훨씬훨씬 좋았어요 *_* 원제인naissance des pieuvres는 &#39;문어들의 탄생&#39; 혹은 &#39;집념이 강한 사람들의 탄생&#39; 으로 중의적으로 읽을 수 있는 제목인 것 같은데, 워터릴리스보다 훨씬 이 영화에 잘 맞는 제목인 것 같습니다. 특정한 시절에 느끼게 되는 광기마저 어린 감정, 순진한 집착 또는 소유욕. 개연성 없어 보일 수 있는 전개를 세상 현실적으로 느낄 수 있도록, 그 감정에 몰입할 수 있도록 감정의 결을 섬세하게 그리는 셀린 시아마에 감탄했읍니다. 내게 없던 일도 추억하게 만드는 영화.."
10,아티스틱스위밍 경기가 나오는 외국산영화가 재미있었지만 10년전부터 박현선&박현하 자매가 2010 광저우 아시안게임때 동메달을 획득하고 2012년까지 런던 올림픽에 참가했고 6년전에는 2014 인천 아시안게임때 아티스틱스위밍 듀엣 경기를 관람한적은 있었고 재작년에는 2018 인도네시아 아시안게임때 듀엣과 팀 경기에 참가하고 작년에 2019 광주 세계수영선수권대회때 솔로와 여성듀엣과 팀과 프리 콤비네이션 경기 참가와 갈라쇼를 공연했고 혼성듀엣이 없어서 참가못했지만 지금은 도쿄올림픽에 참가할려고 했는데 코로나19 때문에 취소하고 내년에 꼭 듀엣과 팀 경기를 참가하고 2년뒤면 2022 후쿠오카 세계수영선수권대회때 혼성듀엣경기와 항저우 아시안게임때 꼭 참가했으면 좋겠습니다. 그리고 4년뒤 프랑스에서 펼칠 2024 파리 올림픽때 혼성듀엣이 참가할지도 모릅니다.
8,앵글에 담기는 복잡미묘한 소녀들의 감성 구도
8,욕망이 무서 운 법
7,레즈(동성애)이야기 였네 깜놀~ 그래도 볼만하다
10,재미와 감동이 있네요. 가족들이랑  함께 보면 좋아요
6,내 취향이 아닌가보다. 보는 동안  그만 보고 싶은 충동이 ㅠㅜ. 어린 여배우들이 고생했겠다.
