score,reple
10,무심코 지나쳤던 공간과 시간들에 대해 생각해보게 되었음~
10,"내가 모르는 이태원, 내가 아는 이태원 그 속에서 살아온 모르는 사람의 삶이라는 것이 흥미로웠던 영화"
10,차분하게 이끌어간 연출이 좋았습니다. 이태원의 맨 얼굴을 존중하는 태도로 볼수 있었습니다.
10,"그들의 삶과 인생이 쌓아올린, 앞으로도 계속 쌓아 올라갈 이태원의 모습을 직접 들을 수 있어 좋았다."
10,감독님 다른 다큐 (자 이제 댄스타임이랑 시국페미)도 재미있게 봤었는데 이번 작품도 좋았어요. 기지촌 성매매 여성 혹은 그 주변의 여성들의 현재 이야기를 그 공간을 중심으로 풀어나간 점이 재미있었어요. 앞으로도 좋은 작품들 기대해요!
10,"너무 많은 생각이드는 영화 였습니다. 이태원에 대해 더 알게되었고, 영화에 출연하신 배우 님들의 인생을 다 알진 못해도, 공감가는 말들이 많아서 좋았습니다. 개인적으로 얼마 안 남은 2019년에 본 영화들 중 제일 좋았습니다."
10,우리가 꼭 알아야 할 이태원의 이야기 생생한 삶의 이야기가 깊이 와닿는다
10,“이게 다큐지.” 소리가 저절로 나오는 생생한 삶의 이야기
10,다큐가 이렇게 재밌을 수 있다니..!! 벌새 감독이 추천해서 봤는데 대만족!
8,이태원의 밤거리 대신 낮거리를 조명하다.
10,타인의 어깨 너머로 보는 이태원과 여성의 삶. 나도 모르게 빠져든다.
10,
10,우리가 잘 알지 못했던 장소와 시간의 기록
10,많은 사람들이 꼭 봐주었으면 하는 영화.
10,필요한 이야기. 들어야 하는 이야기. 그걸 아주 좋은 형태로 들려주는 영화.
10,아주 좋은 술을 한잔 마신 느낌.
10,공간보다 먼저 사람의 삶이 존재했다는 걸 새삼 다시 느꼈습니다.  억지 감동을 자아내지 않는 연출이 좋았고 이태원을 다음 번 방문할 때에는 그 동안과는 다른 감정을 느끼게 될 것 같습니다. 정말 추천하는 영화!!
8,"역사 속에 묻혀있지만 당당하게 살아있는 중, 노년 여성들의 캐릭터, 그들의 목소리를 가감 없이 담아낸 연출이 좋았습니다. 상영관이 적고 추후 vod 서비스가 안 된다는 것이 아쉽네요. 개봉 중에 많이들 보러 가셨으면 합니다."
10,지금 내 옆을 지나쳐가는 얼굴들이 살아왔을 삶들에 대해 생각해보게 만드는 영화
10,이태원에서 살아온 세 여성의 투쟁기록
10,영화 너무 잘 봤어요 기록물로서의 가치도 있습니다^^
9,
10,
10,우리가 몰랐던 알아야할 이야기. 다음작품이 기대됩니다!
10,
8,도시와 노년여성들의 이야기 어떡하든 살아간다
10,이태원이라는 변화무쌍 한 곳에서 굴곡 많은 삶을 살아온 세 여성분을 담담하지만 따뜻하게 담은 감독의 시선이 좋았습니다.
10,사대주의에 빠진 양색시와 개나 괴나 그저 힙하다니까 와 본 젊은이들이 공존하는 그 곳. 이태원..
10,다큐멘터리 영화인데도 집중해서 재미있게 보았어요.영상미에 반했음^^
2,조금 더 강렬해질 수 있었던 소스들을 그저 나열한 영화
10,"어떤 기준의 평가, 판단이 없는 시선으로 그저 바라보기. 보는 이의 경험과 앎에 따라 더 많은 걸 발견하고 느낄 다큐."
10,이태원이라고 하는 공간에 대해 그리고 그곳에서 삶을 영위해가는 사람들에 대해서 담담하게 돌아보게 하는 다큐.
10,사람과 역사와 풍경이 저물어간다
10,동등한 시선으로 본 타인의 삶
10,"여성의 시각에서 여성들의 모습을 다룬, 소외되어 있던 세 분의 이야기를 통해 이태원의 공간성과 역사를 다시 볼 수 있었어요. 역사와 현재까지도요."
10,
10,
10,2019년에 좋은 영화들을 많이 만났었는데 이 영화는 그 영화들과는 다른 의미로 좋은 영화다. 영화를 본 후 빚진 느낌을 지울 수가 없었다.
10,"그저 가서 놀기만 했던 이태원의 새로운 모습, 아니 어쩌면 본모습을 너무 잘 알게된 영화였어요."
7,불꽃놀이 장면은 왜 나오는지 잘 모르겠음 중간중간 마음이 먹먹해지는 포인트가 몇 있음
10,보이지 않던 목소리들. 인물들 삶의 궤적에서 드러나는 삶에 대한 태도. 너무나도 소중한 영화.
8,관광지로만 알려진 이태원의 역사와 현지인의 삶을 엿볼 수 있었습니다.
9,이태원의 한 층 깊은 이야기를 들을 수 있을 것 같아 조금은 흥미로운 마음으로 보기 시작했다. 이내 보는 내내 든 생각은 저 분들이 지금은 그 때보다 잘 풀려 있으셨으면 좋겠다..단순한 동정이 아니라는 건 보신 분들이라면 아실 거다. 다큐라고 하기엔 영화 같은 세련됨이 있어 더 집중해서 볼 수 있는 작품이었다.
10,"너무 좋다, 너무 좋아서 여운이 오래 갈 것 같다.우리는 세상을 다양한 방법으로 살아가고 있으니까"
10,"그들과 함께한 시간들을 기록했다는 것만으로도 만점 주고 싶은 영화..후속편이 나온다면 나키의 제2,3의 인생과 그랜드 올 오프리의 모습과 영화의 밝은 웃음을 다시 한번 보고 싶네요.오랜시간 동안 그들이 진솔하게 자신의 얘기들을 할 수 있게 깊은 신뢰와 연대를 쌓은 감독의 연출력과 따스한 시선에도 감사를 드립니다."
8,다큐인데 전혀 지루히지 않고 마치  인간극장같은 느낌? 볼만햇고 여러생각하게 만듬
10,
10,마냥 번쩍이고 즐거운 것만 같던 이태원의 민낯을 마주한 기분. 영화 내내 덤덤했던 나키 삼숙 영화의 태도가 잊혀지지 않는다.
10,시대를 묵묵히 살아간 여성들에게 바치는 영화
10,결국 자본이 빠져나가면 인심도 낮아지고 삶이 팍팍해진다는 것이다. 이태원의 자본은 미군들의 급여였는데 미군이 빠지고 나타나는 안타까운 문제점
10,이태원이 이런 곳일 줄 몰랐다
10,개성있는 여성 캐릭터들이 반가웠다
10,여성의 이야기에 귀기울일수 있었던 소중한 시간
8,그저 살아온 줄만 알았던 사람들이 지켜나간 역사를 본 기분
10,다큐멘터리 제작자를 꿈꾸는 대학생입니다. '이 작품같은 다큐멘터리를 만들고싶다.'라는 생각이 들었던 너무 좋은 작품이었습니다. 앞으로도 감독님의 작품이 기다려질 것 같습니다.
10,
10,대체 어디 가면 볼 수 있는거죠??
8,사람 안에는 항상 사람이 있으니 항상 조심하자
7,영화보다도 그들의 삶이 더 영화같습니다.
10,흔히 알고 익숙한 관광지느낌의 이태원이 아닌 이태원의 이면을 볼수있는 영화. 새로운 것들이 눈에 많이 들어왔다. 생각을 하게되는 영화.
10,80-90년대 이태원 여성들의 삶을 볼 수 있었고 이태원 주민들에 대해 알 수 있어 좋았다
10,오랜만에 의미있고 잘 만들어진 영화를 관람해서 좋았다.
6,찬란한 불빛.젊음이 가득한 세상.그렇지 않은 이태원.
10,축하하는 펍에서 그리고 tv에 나오는대사에서 동생과 통화가 끝나고 조카랑 같이 있을때.. 이런 장면들이 영화 끝날때 까지도 계속 생각나더라구요.
10,멋진 다큐
10,세 명의 주인공에 대한 이야기를 본인들의 입에서 직접 들을 수 있어 좋았다
9,우리가 잘 몰랐던 누군가의 이야기우리가 어떤 시대를 지나왔나 돌이켜 보게되는 이야기지금 내 앞을 지나고 있는 우리의 역사 이야기
8,"잘 몰랐던 이태원의 과거에 대해서 알게되서 좋았어요. 화려해보이는곳에서도 희노애락이 존재한다는걸 다시금 상기시켜주는 다큐입니다. 이태원에서 한때 화려한 날도 있었고, 힘들었던 날들도 있었지만 그곳에서  &#39;그럼에도 불구하고&#39; 묵묵히 살아가는 사람들의 일상을 담담하게 그린것 같아서 좋아요."
10,"씁쓸한 맛만 남은 초콜릿 상자를 들여다보는 심정이었다. 삼숙, 나키, 영화. 그들의 이름을 기억하는 것으로 그들의 인생이 조금은 달콤해지기를 바란다."
10,기록으로 남겨야할 이태원 여성 국보들의 삶
6,"이태원이라는 공간에 떠도는 기억들, 그리고 시간은 간다."
10,내가 모르던 이태원을 알게되어 좋았습니다. 다큐다운 다큐 한 편 봤네요.
5,다큐를 잘 안 봤는데 재밌게 봤다
10,이태원이라는 지역..그리고 세분의 삶을 통해 조금이나마 이태원이란 곳을 알게되어 감사드립니다
6,"알고 가자, 이태원"
6,묵직한 울림이 잔잔하지만 힘있게 다가온다.
10,"12월 5일에 봤어요 정말 잘 만든 영화고 정말 재밌는 영화예요시간 가는 줄 모르고 봤고, 다큐멘터리인데 음악도 너무 좋아요도합 105점입니다"
1,여성우월주의에 입각한 차별적 프레임 대놓고 감독의 성향을 드러내는 영화
